scientific_name,family,genre,alternative_scientific_names,ca_common_name,description,additional_info,islands,habitat,edibility,es_common_name
Hymenoscyphus scutula (Pers.) Phillips,Leotiaceae,Hymenoscyphus,,,"Seta con el sombrero en forma de copa, de medida muy pequeña, no llega a los 5 mm de diámetro, y está adherido al sustrato por un pie. Es de color crema a amarillento y en la parte interior dónde se encuentra el himenio se vuelve terroso cuando se seca. Su superficie externa no es fértil y es de color blanquecino. El pie es muy fino y puede tener hasta 10 mm de altura, cilíndrico y de color crema a blanquecino. Las esporas tienen forma de huso, de 19-20 x 3-4 micras, y tienen gotas de grasa",,['Mallorca'],['Sobre plantas herbáceas'],Indiferent,
Peziza ampliata Pers,Leotiaceae,Peziza,,,"Tiene forma de copa más o menos cerrada que después se va abriendo para acabar plana, que mide unos 3 cm de diámetro. El margen está cercado hacia el interior y puede ser dentado. El himenio es de color castaño claro en contraste con la superficie externa que es de color blanco puro y un poco granulosa. Las espores son elípticas, lisas, de 17,5-20 x 10-11 micras",,['Mallorca'],['Sobre plantas leñosas'],Indiferent,
Sarcoscypha coccinea (Jacq.) Sacc,Sarcoscyphaceae,Sarcoscypha,['Peziza coccinea Jacquin'],['Cassoletes vermelles'],"Seta de color rojo intenso, de himenio liso, en forma de copa de hasta 5 cm de diámetro. Margen fino y puede presentarse deshilachado o dentado. Tiene un pie más o menos rudimentario. Las esporas son elípticas, en forma de huso, de 30-40 x 10-12 micras",Es muy vistosa y anuncia la llegada del frío,"['Mallorca', 'Menorca']",['Sobre plantas leñosas'],Indiferent,['Peziza escarlata']
Peziza lobulata (Velen.) Svrcek,Leotiaceae,Peziza,['Peziza violacea Persoon ss. Dennis'],,"Seta que inicialmente tiene forma de copa, pero cuando es madura es más o menos ondulada y con pliegues. La superficie interna está formada por el himenio que es de color violáceo, y la externa, también violácea cuando es joven, se vuelve grisácea cuando la seta madura. Las esporas son elípticas, lisas, con dos gotas lipídicas en los extremos que desaparecen en la madurez, de 13-16 x 7-9 micras","Cuando apretamos la seta entre los dedos, deja escapar un líquido aguado con tonos violáceos",['Mallorca'],['Llocs cremats'],Indiferent,
Peziza muscicola Donadini,Leotiaceae,Peziza,,,"Seta muy pequeña, de 0,5 a 2 cm de diámetro, en forma de copa inicialmente, después plana, con el margen ondulado y con una depresión central, y sin pie. El himenio se encuentra en el interior de la copa y es de color marrón cobrizo oscuro y la superficie externa es más clara. Las esporas son elípticas, con verrugas alargadas e interconectadas formando un retículo, de 13-18 x 7,5-9 micras",,['Mallorca'],['Dunes'],Indiferent,
Peziza succosella (Le Gal & Romagn.) M.M Moser ex Aviz.-Hersh. & Nemlich,Leotiaceae,Peziza,,,"Seta de color marrón y ocre hacia la base, en forma de copa de 1 a 3 cm de diámetro que se abre rápido volviéndose casi plana. Es fácil de identificar por el latex amarillo al principio y verdoso con el tiempo, que emite su carne. Las esporas son elípticas con una gota lipídica, de 15-18 x 9-10 micras",Es la Peziza más frecuente en las Baleares,"['Cabrera', 'Dragonera', 'Formentera', 'Ibiza', 'Mallorca', 'Menorca']","['Llocs cremats', 'Zones humides']",Indiferent,
Peziza trachycarpa Curr,Leotiaceae,Peziza,['Plicaria trachycarpa (Currey) Boud'],,"Seta en forma de copa, de 2 a 4 cm de diámetro que con el tiempo vuelve plana con el margen erecto que forma una especie de borde más elevado. En el interior de la copa se encuentra el himenio y es de color violáceo muy oscuro y la superficie externa de la seta también es violácea más clara hacia la base. Esta parece que tiene escamas puntiagudas. Las esporas son redondas, de 9,8-12 micras de diámetro, con verrugas largas y truncadas",,['Mallorca'],['Llocs cremats'],Indiferent,
Peziza vesiculosa Bull,Leotiaceae,Peziza,['Plicaria vesiculosa Bull'],,"Seta en forma de copa sin abrirse del todo, que puede llegar a los 10 cm de diámetro, con el margen curvado y un poco granuloso. En el interior de la copa se encuentra el himenio, que es de color amarillento un poco castaño. La superficie externa es pálida, color beig castaño claro o del mismo color que el himenio y muchas veces se ve furfurácea, hecho que hace que parezca estar cubierta de harina. Las esporas son elípticas, lisas, de 18-25 x 10-13 micras",,"['Cabrera', 'Dragonera', 'Formentera', 'Ibiza', 'Mallorca', 'Menorca']","['Camps de conreu, vores de camins', 'Sobre madera muerta, piñas, tocones']",Indiferent,
Sarcosphaera crassa (Santi) Pouzar,Leotiaceae,Sarcosphaera,"['Sarcosphaera eximia (Dur. Et Lév.) R. Maire', 'Sarcosphaera coronaria (Jacq.: Cke.) Boud']",,"Seta que nace semienterrada en forma globosa, de 5 a 10 cm de diámetro. Al salir al exterior se abre en forma de estrella con 3 o 4 lóbulos. El interior está vacío y liso de color azulado o liláceo. Con la edad la superficie interna puede oscurecerse y pasar a color terroso castaño. Las esporas son elípticas, de 15-20 x 8-9 micras","Sale cuando hace frío y se puede encontrar también en la primavera. Es tóxica en crudo. Se consume bien cocida, pero no muy apreciada",['Mallorca'],"['Alzinar', 'Pinares y otras coníferas']",Indiferent,
Lycoperdon perlatum Pers,Lycoperdaceae,Lycoperdon,"['Lycoperdon gemmatum Batsch', 'Lycoperdon albidumLycoperdon scrobiculatum Velen']","['Bufa de bou', 'Bufa de jai', 'Bufa de jaia', 'Bufa de monja', 'Bufa del dimoni', 'Bufes', 'Esclatabufa piriforme', 'Fumoses', 'Pet de llop', 'Pets de moro']","Carpóforos globulosos o en forma de pera, de 1 a 5 cm de diámetro y unos 6 cm de altura, de color blanco gris o blanco sucio cuando es adulto. En la superficie externa tiene una ornamentación formada por pequeñas perlas color crema, redondas o cónicas que caen en la madurez dejando una señal. La gleba es de color blanco que después se transforma en un polvo de color marrón que se escapa por el ostíolo situado en la parte superior. Las esporas son marrones en masa, redondas, lisas, de 3-4 micras",Comestible sólo cuando es joven y la gleba es totalmente blanca,"['Cabrera', 'Dragonera', 'Formentera', 'Ibiza', 'Mallorca', 'Menorca']","['Alzinar', 'Pinares y otras coníferas']",Comestible,"['Bejín areolado', 'Cuesco de lobo']"
Xerula longipes (P. Kumm.) Maire,Marasmiaceae,Xerula,"['Oudemansiella longipes (P. Kumm.) M. Moser', 'Collybia longipes Quél']",,"Destaca por su pie largo, de 12 cm, fibroso, coriáceo, aterciopelado, más grueso en la base y de color marrón. El sombrero de 3 a 8 cm de diámetro, pasa de convexo-acampanado a plano, con la cutícula aterciopelada de color marrón castaño más o menos oscuro. Las láminas son anchas, espaciadas, de color blanco y las esporas también blancas en masa, subglobosas, de 8-10 x 6-9 micras","Aunque sí es comestible, es de baja calidad. Es rara pero se ha encontrado de forma constante en encinares de Escorca y Sóller",['Mallorca'],['Alzinar'],Indiferent,
Xerula radicata (Relhan) Dörfelt,Marasmiaceae,Xerula,"['Oudemansiella radicata (Relhan) Singer', 'Collybia radicata Fr.: Relhan']",,"Seta con un sombrero viscoso de 4 a 10 cm de diámetro, convexo-acampanado, que pasa a plano y con un mamellón rugoso por los lados. Es de color marrón o marrón tierra. Las láminas son gruesas, espaciadas, blanquecinas, adnatas y con fibrillas. El pie es blanquecino con tonalidades marrones, cilíndrico, fibroso, un poco bulboso en la base y acabado con una especie de raíces muy largas. Las esporas son blancas en masa, elípticas, de 12-16 x 10-12 micras","Especie rara, sólo encontrada en los encinares de Escorca (Mallorca). Es comestible, pero de baja calidad",['Mallorca'],"['Alzinar', 'Sobre plantas leñosas']",Indiferent,
Marasmiellus caesioater (Speg.) Singer,Marasmiaceae,Marasmiellus,,,"Es una pequeña seta con un sombrero de 1 a 3,5 cm de diámetro, plano o con un pequeño mamellón y después incluso hundido con el margen plano. El sombrero presenta una coloración cambiante, al principio gris negruzco que se aclara pasando a crema sucio, principalmente hacia el margen. Las láminas de debajo son de adnatas o decurrentes con la edad y bifurcadas, de color que va del blanquecino a un poco cobrizo. El pie es curvado y más ancho en la parte superior del mismo color que el sombrero o un poco más negro verdoso en la parte inferior. Las esporas son blancas en masa, un poco fusiformes, de (10) 11-13 (14) x (4,5) 5-5,5 (6,5) micras, siendo más grandes las que provienen de basidios bispóricos",Ha sido la primera cita de esta seta en Europa. Se debería proteger íntegramente. Al cogerla su carne huele a anís,['Mallorca'],,Indiferent,
Micromphale brassicolens (Romagn.) P. D. Orton,Marasmiaceae,Micromphale,['Marasmius brassicolens Romagn'],,"Se reconoce fácilmente por su olor a col hervida. Esta seta posee un sombrero de 1,5 a 4 cm de diámetro, plano con el margen estriado en tiempo húmedo. El color es variable, de terroso cobrizo con el margen más claro a crema cobrizo en los ejemplares viejos. Las láminas con numerosas lamelas son blanquecinas al principio y posteriormente cobrizas. El pie, del mismo color que el sombrero en la parte superior y negruzco en el resto, es cartilaginoso, surcado y plano. Las esporas son blancas en masa, elípticas, de 6-8 x 3-3,5 micras",Crece en grupos muy numerosos,"['Cabrera', 'Dragonera', 'Formentera', 'Ibiza', 'Mallorca', 'Menorca']","['Alzinar', 'Pinares y otras coníferas']",Indiferent,
Melanogaster variegatus (Vittad.) Tul. & C. Tul,Melanogastraceae,Melanogaster,,,"Seta que se puede identificar por dos cosas, por el olor agradable y gusto a regaliz y por volverse negra cuando se toca. Seta en forma de patata de 2 a 6 cm de diámetro de color amarillento al principio para pasar a color tierra. Está cubierta de pequeñas fibrillas muy aplicadas. La gleba es casi negra, formada por pequeñas celdas de paredes blancas que contienen las esporas. Éstas son de color tierra lisas, elipsoidales, de 6-8 x 4-5,5 micras",Se encuentra sobre el terreno siempre un poco enterrado,"['Mallorca', 'Menorca']","['Alzinar', 'Pinares y otras coníferas']",Indiferent,"['Melanogastro castaño', 'Melanogastro variado']"
Abortiporus biennis (Bull.) Singer,Merapilaceae,Abortiporus,"['Polyporus biennis (Bull.) Fr.', 'Polyporus rufescens (Pers.) Fr']",,"Seta blanca o blanca rosada con puntos más rojos de forma muy irregular, puede parecerse a medio embudo o a una copa, con pie o sin, formando grupos numerosos. Tiene poros de 2-5 mm, blanquecinos, después rosados y color castaño, de redondos a alargados, formando una especie de láminas onduladas. Las esporas blancas en masa, elipsoidales, lisas, de 4,5-6 x 3-5 micras",Es muy frecuente,['Mallorca'],['Sobre plantas leñosas'],Indiferent,
Antrodia serialis (Fr.) Donk,Meripilaceae,Antrodia,,,"Puede aparecer pegado a la madera de la cual cuando es joven se separa fácilmente, o en forma resupinada. Tiene poros y tubos dispuestos en forma de pisos de arriba abajo. Cuando es joven es de color blanco y después se vuelve color crema o ocre. Las esporas son cilíndricas y en forma de riñón, lisas, de 4-5 x 1-1,5 micras",Provoca podridura blanca en la madera,['Cabrera'],"['Sobre madera muerta, piñas, tocones']",Indiferent,
Rigidoporus ulmarius (Sowerby) Imazeki,Meripilaceae,Rigidoporus,,,"Es una seta de gran tamaño, que crece cada año en forma de ménsula, más o menos plana de hasta casi 30 cm de diámetro y 8 de grueso. La superficie superior es primero tomentosa y después sin pelos, color crema, con el margen más grueso y redondeado, de blanquecino a amarillento. El himenio, que está en la parte inferior, está formato por unos tubos largos, de rosados a anarnjados y con numerosos poros, finos y apretados. Las esporas son blanquecinas en masa, globosas, de 6-8 micras",Podemos ver un ejemplar sobre un platanero (Platanus orientalis L.) delante del huerto del rey en la ciudad de Palma,"['Cabrera', 'Dragonera', 'Formentera', 'Ibiza', 'Mallorca', 'Menorca']",['Sobre plantas leñosas'],Indiferent,
Morchella elata Fr,Morchellaceae,Morchella,,['Múrgola'],"Las fructificacions de esta seta son de 10 a 15 cm de altura, con la parte superior piramidal y vacía. Presenta costillas paralelas transversales que forman alveolos de color marrón. Las costillas se ennegrecen con la edad. Destaca el pie del resto por su color blanco, pero es liso y vacío como el sombrero. Las esporas son elípticas, de 18-25 x 11-15 micras","Se encuentra en grupos de muchos individuos, aunque no es frecuente",['Mallorca'],"['Alzinar', 'Pinares y otras coníferas', 'Zones humides']",Comestible,
Morchella rotunda (Fr.) Boud,Morchellaceae,Morchella,['Morchella esculenta var. rotunda Pers'],['Múrgola'],"Las fructificaciones parecen celdas de abejas o un cerebro y pueden llegar a los 12 cm de altura. La fructificación está formada por costillas transversales y longitudinales que forman alveolos. Éstos están tapizados por el himenio y son de color amarillo intenso o dorado. El pie es ancho, liso, vacío, de color blanco, crema con el tiempo, a veces ramificado y más ancho en la base. Las esporas son de color tierra amarillento, elípticas, de 18-20 x 10-12 micras",Es muy buen comestible,['Mallorca'],['Llocs cremats'],Comestible,
Mycenastrum corium (Guers.) Desv,Mycenastraceae,Mycenastrum,,,"En forma esférica de hasta 10 cm de diámetro. La superficie externa es membranosa y dura, de color blanquecino y sucia. Una vez madura se abre hasta la mitad formando en la parte superior láminas triangulares giradas hacia fuera. La parte interna o gleba primero es blanquecina y después se convierte en un polvo marrón formada por esporas. Estas son marrones en masa, subglobosas, de 12 x 8-10,5 micras y son diseminadas por una apertura que se encuentra en la parte superior de la envoltura",,['Mallorca'],['Alzinar'],Indiferent,
Cyathus olla (Batsch) Pers,Nidulariaceae,Cyathus,"['Cyathus nitidus Roth', 'Cyathus agrestis Pers.', 'Cyathus lentiferus (L.) P. Karst']",['Trompeta petita'],"Seta muy pequeña en forma de copa alargada, de 9 a 15 mm de altura y de 7 a 13 mm de diámetro. La base es estrecha y la boca ancha. La superficie externa es tomentosa y de color gris marrón y la superficie interna es lisa, brillante y de color entre gris pálido a oscuro. Dentro de la copa encontramos una especie de huevos pequeños de 2 a 3 mm, en forma de lenteja de color gris, brillantes y están amarrados a la pared por un filamento que contienen las esporas. Éstas son elipsoidales de 9-12 x 7-9 micras y cuando llueve, las gotas hacen que estos huevos proyecten las esporas hacia fuera",,['Mallorca'],['Pinares y otras coníferas'],Indiferent,['Ciato atrompetado']
Cyathus striatus (Huds.) Willd,Nidulariaceae,Cyathus,,['Niuet estriat'],"Seta con forma de copa de 1-1,5 cm de altura, más estrecha en la base. La parte externa es de color marrón ferruginosa, de superficie lacerada-filamentosa y la interna glabra, de color gris blanquecino y con características estrías longitudinales. Las esporas son hialinas, elipsoidales, lisas, de paredes gruesas, 14-18 x 6,5-11,5 micras","Una cierta semejanza presentan las Nidularia, pero estas no tienen una membrana antes de abrirse como el Cyathus striatus ni tampoco funículo en los peridíolos",,"['Sobre madera muerta, piñas, tocones']",,['Ciato estriado']
Omphalotus olearius (DC.) Singer,Omphalotaceae,Omphalotus,"['Clitocybe olearia (DC.: Fr.) Maire', 'Pleurotus olearia (DC.: Fr.) Gillet']","[""Bolet d'oliu"", ""Gírgola d'olivera"", 'Pixacà']","Seta toda ella de coloración que va del amarillo oro al amarillo azafrán más o menos rojizo. Sombrero de hasta 10 o 15 cm de diámetro, primero convexo pero se vuelve en forma de embudo con el margen muchas veces levantado. El pie es central o excéntrico, más o menos curvado y tiene numerosas láminas decurrentes hacia el pie de color amarillo dorado que nos pueden manchar las manos al tocarlas. Las esporas son blancas en masa, de ovoides a subglobosas, lisas, 5-7 x 5-6 micras","Frecuente y crece en grupos numerosos, es tóxica y provoca problemas gastrointestinales. Presenta luminiscencia si la seta es fresca durante dos o tres días en un ambiente sin nada de luz","['Cabrera', 'Dragonera', 'Formentera', 'Ibiza', 'Mallorca', 'Menorca']","['Alzinar', ""Garriga d'ullastre"", 'Sobre plantas leñosas']",Indiferent,['Seta de olivo']
Paxillus panuoides (Fr.) Fr,Paxillaceae,Paxillus,"['Paxillus acheruntius Humb. J. Schröt. ', 'Paxillus lamerillugus D.C']",['Gírgola de pi'],"Forma de concha o lengua irregularmente ondulada de 3 a 8 cm de diámetro de color amarillento a beig a amarillento oliva, gris a veces que con la edad se vuelve coriáceo. El pie si tiene es muy corto y lateral. Presencia de láminas de color ocre anaranjado que a veces están conectadas unas con las otras por una especie de venas perpendiculares a ellas. Las esporas son de color terroso arcilla en masa, ovaladas, de 4-6 x 3-4 micras",No demasiado gustosa y sólo se tienen que consumir ejemplares jóvenes y es necesario hervirlos antes de cocinarlos,"['Cabrera', 'Dragonera', 'Formentera', 'Ibiza', 'Mallorca', 'Menorca']",['Sobre plantas leñosas'],Indiferent,
Otidea cochleata (Huds.) Fuckel,Pezizaceae,Otidea,,,"Seta de color marrón más o menos oscura en forma de oreja con uno de los lados no soldado que puede medir hasta 6 cm de altura y crece en grupos de numerosos individuos. El pie es blanquecino más o menos rudimentario. Las esporas son elípticas, lisas, de 15-18 x 7-9 micras",Generalmente sale cuando hace frío,['Mallorca'],['Alzinar'],Indiferent,
,,,['Otidea umbrina (Pers.) Bres'],,,,,,,
Aleuria aurantia (Pers.) Fuckel,Pyronemataceae,Aleuria,['Peziza aurantia Pers.: Fr'],['Cassoleta ataronjada'],"Seta sin pie en forma de copa y de color muy anaranjado pasando a color más claro amarillento y plana con los márgenes muy ondulados. Puede medir de 3 a 6 cm de diámetro. Las esporas son elípticas y cubiertas por una red externa muy vistosa, de 15-20 x 9-10 micras",Se come de postre con miel,['Mallorca'],['Pinares y otras coníferas'],Comestible,['Peziza anaranjada']
Peziza endocarpoides Berk,Pezizaceae,Peziza,['Plicaria endocarpoides (Berkel.) Rifai'],,"Seta en forma de copa, de 1 a 5 cm de diámetro, inicialmente cerrada y progresivamente se va abriendo para ser casi plana. El interior de la copa es marrón negruzco, casi negro con el tiempo y por fuera tiene pequeñas verrugas y es de un color más claro que el interior con tonos violáceos. Las esporas son lisas, redondas, de 9,3-11 micras de diámetro",Tiene una especie de látex opalescente que con el tiempo se vuelve amarillo,['Mallorca'],['Llocs cremats'],Indiferent,
,,,['Peziza praetervisa ss. Breitenbac-Kränzlin'],,,,,,,
Peziza subviolacea Svrcek,Pezizaceae,Peziza,,,"Seta en forma de copa, finamente granulosa, amarillenta, de 3-4 cm de diámetro. Inicialmente con el margen girado interiormente, después se va abriendo y finalmente se dobla hacia el exterior. El himenio, que está dentro la copa, es de color violáceo oscuro muy brillante y con el tiempo se aclara y pierde la brillantez. Por fuera es grisáceo, marrón violáceo o marrón oliva. Las esporas son elípticas, lisas, con dos gotas lipídicas, de 5-14 x 6,5-7,4 micras",,"['Cabrera', 'Ibiza', 'Mallorca']",['Llocs cremats'],Indiferent,
Phallus impudicus L,Phallaceae,Phallus,"['Jaczewskia phalloides Matt.', 'Ithyphallus impudicus (L.: Pers.) E. Fischer']",['Ou del diable'],"Seta al principio subterránea, en forma de huevo inicialmente, de 4-6 x 3-5 cm con una especie de raíz más o menos ramificada, de color blanco y floja al tacto. El peridio se abre y emerge un pie blanco, esponjoso y vacío, acabado por una parte cónica, de color verde oliva y con un olor repugnante que la identifica. Puede medir hasta 20 cm de altura. Las esporas son de color amarillo pálido, lisas, un poco ovaladas, de 3-5 x 1,5-2 micras",Característico por el olor insoportable que hace,['Mallorca'],"['Alzinar', 'Pinares y otras coníferas']",Indiferent,['Falo hediondo']
Pulcherricium caeruleum (Lam.) Parmasto,Phanerochaetaceae,Pulcherricium,"['Corticium caeruleum (Schrad.) Fr.', 'Thelephora caeruleum Fr']",,"Seta de color azul y márgenes blanquecinos (cuando es joven) que se desarrolla sobre madera en forma de costra con una superficie lisa o irregular formando una sucesión de nudos.Las esporas son elípticas, hialinas, de 7-11 x 5-6 micras",Especie característica por su color azul añil,['Mallorca'],"['Alzinar', 'Sobre madera muerta, piñas, tocones']",Indiferent,
Hohenhuehelia geogenia (D.C.) Singer,Pleurotaceae,Hohenhuehelia,"['Acanthocystis geogenius (D. C.: Pers.) P. Kumm. ', 'Pleurotus geogenius Gillet']","['Gírgola', 'Gírgola de carboner', 'Gírgola de garriga', 'Gírgola de marina', 'Gírgola de pi', 'Orellana']","Esta seta tiene forma de oreja o concha con la parte superior del sombrero abierta como un abanico y el pie que parece una continuación del mismo, que puede ser totalmente excéntrico o lateral. El sombrero mide de 5 a 14 cm de diámetro, es gelatinoso en tiempo húmedo, liso, reluciente y con manchas blanquecinas y de color que va del gris a marrón oscuro. El pie es algo más claro que el sombrero contrastando con las láminas que son blanquecinas, apretadas y muy decurrentes. Las esporas son blancas en masa, elípticas, lisas, de 7-10 x 4-5 micras",Crece en tierra pero siempre ligado a raíces o tocones. Se suele encontrar en colonias de muchos individuos,"['Cabrera', 'Dragonera', 'Formentera', 'Ibiza', 'Mallorca', 'Menorca']","['Alzinar', 'Pinares y otras coníferas']",Comestible,
Pleurotus eryngii (DC.) Quél,Pleurotaceae,Pleurotus,,"[""Bolet d'espinacal"", ""Gírgola d'arena"", 'Gírgola de camp', 'Gírgola de card']","Es una de las setas más apreciadas en la cocina compuesta por un sombrero de 4 a 10 cm, carnoso, convexo al principio para pasar a deprimido y con el margen enrollado. El color del sombrero va del blanco crema al marrón cobrizo. Las láminas son decurrentes, gruesas, un poco separadas, de color blanquecino o amarillento. El pie, que puede ser central o excéntrico, es macizo, cilíndrico, largo y normalmente curvado y atenuado en la base. Las esporas son blancas en masa, elípticas, de 10-13 x 5-6 micras",Comestible excelente y buscado en muchos de países de Europa,['Mallorca'],"['Dunes', 'Sobre plantas herbáceas']",Comestible,"['Oreja de cardo', 'Seta de cardo']"
Amanita rubescens Pers,Pluteaceae,Amanita,,,"Esta seta presenta un sombrero de hasta 15 cm de diámetro que de hemisférico pasa a plano y de color tierra cobrizo a color vino, con escamas blanquecinas casi semicirculares. Las láminas son apretadas, con lamelas blancas que tienen manchas cobrizas con la edad. Las esporas son blancas en masa, elípticas, de 8-10 x 6-7 micras. El pie, que es blanco-rojizo tiene un bulbo grueso y rojizo y lleva un anillo persistente, estriado, blanco en la parte superior y del mismo color que el pie en la inferior. La volva, en la base del pie, se deshace rápidamente",Se debe comer bien cocida porque cruda puede ser tóxica. Su gusto recuerda a las gambas,['Menorca'],['Alzinar'],Comestible,
Pluteus romellii (Britzelm.) Lapl,Pluteaceae,Pluteus,,,"Seta con un sombrero de unos 3 cm de diámetro, pronto plano, con el margen ondulado que se levanta un poco con la edad. Con la ayuda de una lupa se pueden observar una especie de venas en relieve características del sombrero. Las láminas están libres, un poco ventrudas, de color amarillo pálido que con la caída de las esporas se vuelven rosadas. El pie es erguido y de un color amarillo muy vistoso. Las esporas son rosadas en masa, de subglobosas a globosas, de 6-7 x 5-6 micras","Especie de pequeño tamaño, no muy frecuente y con un cierto comportamiento pirófilo","['Cabrera', 'Mallorca', 'Menorca']","['Alzinar', 'Llocs cremats']",Indiferent,
Volvariella gloiocephala (DC.) Boekhout & Enderle,Pluteaceae,Volvariella,['Volvariella speciosa (Fr.) Singer var. gloiocephala (DC.) Singer'],,"Seta con un sombrero de 6 a 12 cm de diámetro, cónico con el ápice obtuso que posteriormente se abre, viscoso en tiempo húmedo y de color variable, generalmente gris ahumado. Las láminas son blancas, delgadas, libres, un poco gruesas que se manchan de color rosado oscuro por la caída de las esporas. El pie es atenuado en la parte superior, con la base un poco gruesa que presenta una volva irregular, no muy grande y enterrada. Es de color blanco grisáceo. Las esporas son rosadas en masa, de elipsoides a ovoides, de 13-18 x 7,5-8 micras",Suele salir en los mismos lugares cada año,"['Ibiza', 'Mallorca']",,Indiferent,
Volvariella murinella (Quél.) M.M. Moser,Pluteaceae,Volvariella,,,"Esta es una seta de gusto dulce y olor a geranio. El sombrero de hasta 7 cm de diámetro, primero acampanado y con un ancho mamellón plano y obtuso en el centro. El color varía, inicialmente blanco y grisáceo en el centro del sombrero volviéndose totalmente gris con el tiempo. Las láminas primero ascendentes, después planas, frágiles, blancas para pasar a rosadas por la caída de las esporas. Éstas son rosadas en masa, elipsoidales, de 6-7 x 3,5-4,5 micras. El pie es más o menos cilíndrico, largo, liso, de color blanco donde en la base encontramos una pequeña volva formada por cuatro lóbulos, de color blanquecino que se mancha de marrón o grisáceo con el tiempo","Seta vistosa, que presenta muy típicamente una volva blanca y huele a geranio","['Cabrera', 'Menorca']","['Dunes', 'Pinares y otras coníferas']",Indiferent,
