scientific_name,family,genre,alternative_scientific_names,ca_common_name,description,additional_info,islands,habitat,edibility,es_common_name
Russula delica Fr,Russulaceae,Russula,['Lactarius exsuccus (Otto)'],"['Blanqueta', 'Blava', 'Bolet fort', 'Campanilles', 'Cogoma', 'Esclata-sang blanc', ""Esclata-sang d'alzina"", 'Forta', 'Fortes', 'Llora blanca', 'Pebràs']","Seta con sombrero de 6 a 15 cm de diámetro de color blanco sucio a crema, convexo primeramente y después plano para finalmente adquirir la forma de embudo. El margen es uniforme, enrollado hacia abajo y un poco ondulado. Suele estar cubierto de tierra y de hojas que la misma seta ha removido para poder salir. Las láminas son espaciadas, poco decurrentes, adnatas y de color blanco. El pie es corto, de 3-6 x 2-3 cm, cilíndrico y muy duro, de color blanco con manchas marrones. Las esporas son de color crema muy claro en masa, elípticas o casi redondas, de 8-11 x 6-9 micras",Muy corriente y puede encontrarse en verano si hay lluvias abundantes,"['Cabrera', 'Dragonera', 'Formentera', 'Ibiza', 'Mallorca', 'Menorca']",['Alzinar'],Comestible,['Rúsula blanca']
Lactarius mairei Malençon,Russulaceae,Lactarius,,"['Esclata-sang bord', 'Esclata-sang de llet']","Seta con un sombrero de hasta 5 cm de diámetro, de color amarillo apagado y con pelos por el margen dispuestos de una forma paralela, que se ven cuando se pone el sombrero a contraluz. Debajo del sombrero las láminas son del mismo color que este, apretadas, adnatas y un poco ahorquilladas. El pie a veces presenta una especie de reborde redondeado que envuelve la parte superior. Las espores son de color crema claro en masa, de subglobosas a elipsoidales, de 6,5-8 x 5,5-6 micras",,"['Mallorca', 'Menorca']",['Alzinar'],Indiferent,
Lactarius mediterraneensis Llistos. & Bellù,Russulaceae,Lactarius,,,"Seta con sombrero de 4 a 13 cm de diámetro que lo podemos encontrar de varias formas, convexo, plano y deprimido en el centro y en forma de embudo dependiendo de la edad. Es untuoso al tacto, zonado y de color crema rosado a ocre amarillento. Las láminas de adnatas a decurrentes, color ocre crema primero, después ocre sucio, naranja ocre a rojo marronáceo cuando se tocan. Las esporas también ocres en masa, subglobosas y ornamentades con crestas, de 9-13,5 x 7,5-11 micras. El pie es cilíndrico, tomentoso al principio, liso y glabro más tarde, de color blanco crema, volviéndose más oscuro con la edad",No es comestible por su carne picante y se debe proteger por su rareza,"['Mallorca', 'Menorca']",['Alzinar'],Indiferent,
Lactarius sanguifluus (Paulet) Fr,Russulaceae,Lactarius,,"['Esclata-sang', 'Esclata-sang de murta', 'Esclata-sang de pi', 'Esclata-sang de xipell', 'Esclata-sang mascle', 'Pebràs', 'Pinatell', 'Rovelló']","El Lactarius sanguifluus tiene un sombrero de 6 a 15 cm de diámetro, al principio convexo con el margen enrollado y después se abre, y a veces, en forma de embudo. Tiene coloraciones naranjas rojizas a rojizo flojo con manchas verdosas no demasiado grandes y normalmente presenta zonaciones en forma de círculos concéntricos. Las láminas son finas, apretadas, decurrentes y de colores variables de rosado carnoso a un naranja rojizo hasta de color vino. El pie es cilíndrico, atenuado en la base, duro y después vacío de color naranja rojizo a color vino con tonos intermedios. Las esporas son blancas en masa, ovoidales, reticuladas, con pequeñas berrugas, y de 7,5-8,5 x 6,5-7,5 micras",Es la seta más buscada y considerada más sabrosa de las Baleares,,['Pinares y otras coníferas'],Comestible,
Lactarius tesquorum Malençon,Russulaceae,Lactarius,,"['Esclata-sang bord', 'Esclata-sang de llet', 'Esclata-sang pelut', 'Peloses', 'Peludes']","Seta de color ocre rosado con sombrero pequeño, con el margen muy enrollado y lanoso. Con el tiempo se abre y puede medir hasta 9 cm de diámetro. El centre es poco peludo y contrasta con los márgenes que lo son mucho. Debajo del sombrero encontramos láminas muy apretadas, con numerosas lamelas de color de rosa a crema rosado. El pie es más corto que el diámetro del sombrero y atenuado en la base. Las esporas son de color crema en masa, elipsoidales, con berrugas y de 7-9 x 5,9-6,5 micras","Es tóxico o al menos responsable de intoxicaciones, aunque en Italia se considera comestible","['Cabrera', 'Dragonera', 'Formentera', 'Ibiza', 'Mallorca', 'Menorca']","[""Garriga d'ullastre""]",Tòxic,
Lactarius zonarius (Bull.) Fr,Russulaceae,Lactarius,,"['Enganyapastors', 'Esclata-sang blanc', 'Esclata-sang bord', 'Esclata-sang coent', ""Esclata-sang d'alzina"", 'Esclata-sang de llet', 'Esclata-sang de lletrada']","Seta con sombrero de hasta 12 cm de diámetro, primero convexo con el margen enrollado y, con el tiempo, aplanado, hundido en el centro y con el margen abierto. Presenta una cutícula muy zonada de color amarillo anaranjado, con círculos concéntricos más oscuros y rojizos. El pie es del mismo color que el sombrero, corto y cilíndrico. Las láminas, numerosas, de blanquecinas a ocres, apretadas, de adnatas a adnado-decurrentes. Las esporas son de color crema blanquecino en masa, de elípticas a ovoidales, con berrugas, de 8-9 x 6-7,5 micras","Es comestible después de herbirlo, aunque no se recomienda su consumo","['Mallorca', 'Menorca']",['Alzinar'],Indiferent,
"Lactarius zugazae G. Moreno, Montoya, Band.-Muñoz & Heykoop",Russulaceae,Lactarius,,,"Seta que al corte presenta abundante látex blanco opalescente y de olor fuerte y característica. Éste presenta un sombrero de hasta 9 cm de diámetro, convexo y plano al centro, deprimido con la edad. El margen que primero es involuto, se aplana y se presenta posteriormente ondulado. Es zonado y de color marrón cobrizo más oscuro o claro por zonas. Debajo del sombrero, las láminas tienen numerosas lamelas, apretadas, intervenadas y un poco ahorquilladas, de adnatas a un poco decurrentes, de color crema que más tarde vuelve rojizo y manchado de óxido. Las esporas son crema rosado en masa, de globosas a elipsoidales, con verrugas soldadas en crestas de 6-9 x 6-7 micras. El pie es macizo y después se vacía, un poco curvado y de color parecido al sombrero","Cuando sale lo hace en grupos de numerosos individuos, pero es poco frecuente. Es amargo, pero el gusto amargo desaparece durante la cocción",['Mallorca'],['Alzinar'],Comestible,
Russula grisea (Batsch) Fr,Russulaceae,Russula,,"['Blava vera', 'Blaveta', ""Blaveta d'alzina"", 'Boleta blava', ""Gírgola d'alzina"", 'Gírgola de carboner']","Seta con el sombrero de hasta 10 cm de diámetro, convexo, de colores variables, de azul verdoso hasta un gris azulado. El centro suele ser de color marrón cremoso o decolorado. El pie en cambio es blanquecino y cilíndrico. Las láminas son apretadas de color blanco. Las esporas son de color crema en masa, elipsoidales y con berrugas, de 6-9 x 5,5-6,5 micras",,['Mallorca'],"['Alzinar', ""Garriga d'ullastre""]",Comestible,
Russula insignis Quél,Russulaceae,Russula,['Russula livescens (Batsch.) Quél'],['Blava'],"Seta con sombrero de hasta 7 cm de diámetro, convexo y deprimido en el centro de color marrón con diferentes tonos, que presenta manchas como de óxido. El margen es acanalado y presenta pequeños bultos. Las láminas blanquecinas son apretadas, bifurcadas cerca del pie y quebradizas. El pie es casi cilíndrico, con el tiempo esponjoso y finalmente vacío. Se reconoce ya que al tacto la carne se vuelve rojiza. Las esporas son de color crema pálido en masa, ovoidales o elípticas con berrugas, de 6,5-8 x 5-6,5 micras",Curiosamente se le llama azul aunque es marronosa,['Mallorca'],"['Alzinar', ""Garriga d'ullastre""]",Comestible,
Russula maculata Quél.: Roze,Russulaceae,Russula,,,"Seta con cutícula brillante de colores con tonos que van de los rojizos a naranjas más o menos intensos. En el centro puede haber placas de color crema. Este mide hasta 10 cm de diámetro, primero convexo y después plano y deprimido en el centro. Los márgenes son ondulados y presentan surcos cuando son más mayores. Debajo del sombrero, las láminas están apretadas y bifurcadas cerca del pie, conectadas entre si, de color crema. El pie es largo y redondeado en la base de color blanco con reflejos anacarados. Tanto el pie, como el sombrero y las láminas con la edad pueden presentar manchas com de óxido. Las esporas son de color amarillo en masa, elipsoidales con pequeñas berrugas, de 7,5-11 x 7-9 micras","Es relativamente frecuente en Mallorca, sobretodo en la Sierra de Tramuntana. No és comestible porque es picante","['Mallorca', 'Menorca']",['Alzinar'],,
Russula olivacea (Schaeff.) Fr,Russulaceae,Russula,,['Blava'],"Seta de color variable, de verde a marrón oliva, aunque a veces violáceo, rojo oscuro, púrpura, etc. con un sombrero de hasta 18 cm de diámetro, que pasa a lo largo de su estadio por diferentes formas, globoso al principio, luego convexo para finalmente ser plano, un poco deprimido en el centro. Láminas muy finas, apretadas y casi libres, después más separadas, con bifurcaciones cerca del pie de color amarillo pálido volviéndose terrosas. El pie es casi cilíndrico, un poco largo y robusto. Está lleno, después blando y un poco rugoso, de color blanco con tonos rosados o violáceos. Las esporas son de color amarillo oro en masa, ovoidales con gruesas puntas o verrugas, de 8-12 x 7-10 micras",Se puede comer crudo aunque a algunas personas le puede resultar indigesto si no está bien cocido. Los últimos años ha habido polémica sobre su presunta toxicidad,['Mallorca'],['Alzinar'],Comestible,
Russula seperina Dupain,Russulaceae,Russula,,,"Seta con un sombrero de hasta 10 cm de diámetro, primero convexo, después plano y deprimido en el centro con el margen curvado hacia dentro y con el tiempo se puede convertir en acanalado. La coloración es variable, rosa, rojo y violáceo a marrón y crema. Las láminas están apretadas, bifurcadas cerca del pie y se conectan con las vecinas, son frágiles y de color crema que con el tiempo se oscurecen. El pie es más grueso en la parte inferior y redondo en la base, un poco rugós y de color blanco que con el tiempo se vuelve grisáceo. Las esporas son de color blanco en masa, ovoides y presentan verrugas más o menos apretadas y agudas, de 8-10 x 7-9 micras",,['Mallorca'],['Alzinar'],Indiferent,
Russula torulosa Bress,Russulaceae,Russula,,"['Blava', 'Blaveta', 'Bolet vermell', ""Mare d'esclata-sang""]","Esta especie forma parte de un grupo de Rúsulas de coloraciones rojas o púrpuras, y además muy picantes. Consta de un sombrero de 4 a 10 cm de diámetro, primero convexo y luego pasa a plano y ligeramente deprimido en el centro con el margen levantado. El color del sombrero contrasta con el blanco o crema de las láminas. Éstas son apretadas y suavemente decurrentes. El pie es corto y fuerte, de 2 a 6,5 cm x 1 a 2 cm, cilíndrico, algo curvado, de color blanco con tonos violetas y rojizos. Las esporas son blancas con tonos ocres en masa, tienen verrugas, de 8-9 x 6,5-8 micras",Hay gente que lo consume tras hervirla y rechazar el agua. Es muy frecuente en las Baleares,"['Cabrera', 'Dragonera', 'Formentera', 'Ibiza', 'Mallorca', 'Menorca']",['Pinares y otras coníferas'],Indiferent,
Pithya cupressina Fuckel,Sarcoscyphaceae,Pithya,,,"Las fructificaciones son en forma de disco plano de unos 3 mm de diámetro, de color naranja intenso, igual que el himenio que está en la parte superior. Las esporas son globosas, de 9-10 micras de diámetro",Poco frecuente,"['Cabrera', 'Dragonera', 'Formentera', 'Ibiza', 'Mallorca', 'Menorca']","['Sobre madera muerta, piñas, tocones', 'Sobre plantas leñosas']",Indiferent,
Schizophyllum commune Fr,Schizophyllaceae,Schizophyllum,,,"Seta generalmente sin pie con el sombrero en forma de concha o parecida a un abanico con pequeños pelos erizados. El sombrero mide de 1 a 5 cm de diámetro, de color blanco puro un poco grisáceo. Las láminas presentan unos reflejos rosados y típicamente bífidas. Las esporas son blancas en masa, cilíndricas, de 3-4 x 1-1,5 micras","Prácticamente se encuentra en todo el mundo, incluso, uno de los autores la ha encontrado en el jardín de un hotel de la India","['Cabrera', 'Dragonera', 'Formentera', 'Ibiza', 'Mallorca', 'Menorca']","['Sobre madera muerta, piñas, tocones', 'Sobre plantas leñosas']",Indiferent,['Esquizofilo común']
Pisolithus arrhizus (Scop.) Rauschert,Sclerodermataceae,Pisolithus,"['Pisolithus tinctorius (Pers.) Coker et Couch.', 'Pisolithus arenarius Alb.: Schw.', 'Pisolithus crassipes (D.C. & Desp.) Petri.', 'Polysaccum boreale P. Karst']",,"Carpóforo de 5 a 15 cm de forma subglobosa o piriforme y de color amarillo o marrón amarillento que se prolonga en una especie de pie muy variable, de nulo a hasta 8 cm. La superficie es dura, rugosa y quebradiza. El interior está formado por muchos de peridios irregulares y dispuestos en capas bien diferenciadas: la inferior con peridios inmaduros de color amarillo, la media de color marrón negruzco y la superior de color tierra. Las esporas son marrones en masa, esféricas, cubiertas de espinitas, de 8-10 micras, ferruginosas que salen por la parte superior del carpóforo",Se ha empleado como colorante. No es muy común,"['Mallorca', 'Menorca']","['Camps de conreu, vores de camins']",Indiferent,
Scleroderma verrucosum (Bull.) Pers,Sclerodermataceae,Scleroderma,,['Pota de cavall'],"El carpóforo es subgloboso o un poco achafado, de 3,5 a 7 cm de diámetro que presenta un pseudopie muy desarrollado y con numerosos rizomorfos que retienen restos de tierra. El peridio es frágil, marrón, con la capa externa que puede ser lisa o cuarteada en forma de escamas finas e irregulares. La gleba es de color azul violáceo de joven, después se vuelve en una especie de polvo marrón. Tiene olor desagradable y las esporas salen por una ruptura en la parte superior y son de color marrón intenso en masa, esféricas, cubiertas de pequeñas espinas, de 8-11 micras",Se puede considerar tóxica. Es muy frecuente en Mallorca y Menorca,"['Mallorca', 'Menorca']",['Alzinar'],Tòxic,
Ciboria batschiana (Zopf) N.F. Buchw,Sclerotiniaceae,Ciboria,,,"Seta con el sombrero en forma de copa marrón más o menos rosado dependiente de la humedad. Éste es plano, puede tener 1,5 cm de diámetro y presenta un pie cilíndrico en la parte inferior, de hasta 2 cm de largo y de color casi negro. Las esporas son elípticas con los extremos más delgados, de 6-11 x 4-6 micras",Se pueden observar incluso dos o tres ejemplares por bellota,['Mallorca'],"['Alzinar', 'Sobre madera muerta, piñas, tocones']",Indiferent,
Sphaerobolus stellatus Tode,Sphaerobolaceae,Sphaerobolus,"['Sphaerobolus stercolarius Fr. & Nordh.', 'Sphaerobolus impatiens Boudier.', 'Sphaerobolus carpobolus (L.): Schoert']",,"Seta muy pequeña de 2mm de diámetro, blanquecina o amarillenta, que cuando madura se abre por la parte superior en forma de estrellita de 6 a 9 puntas. En el interior se encuentra un peridiolo con forma de esfera amarillenta que guarda las esporas. Cuando la humedad es óptima y por ósmosis estas esferitas son proyectadas a distancia. Las esporas son blancas en masa, hialinas y lisas, de 8 x 5 micras",,['Mallorca'],"['Alzinar', 'Excrements']",Indiferent,
Stereum hirsutum (Willd.) Pers,Stereaceae,Stereum,"['Thelephora concentrica Alb. & Schw.: Fr. ', 'Stereum persoonianum Britz.', 'Corticium reisneri Velen ', 'Auricularia reflexa Bull']",,"Seta dura en forma de costra pegada a la madera o formando una serie de pequeños sombreros semicirculares agrupados y que salen hacia fuera del tronco. La parte superior de color amarillo, con tonos entre naranjas y marrones, zonada, aterciopelada o hirsuta, con un margen que suele ser de color amarillo vivo, seguido de una zona gris y peluda. La medida varia de 2-6 x 1-2 cm. Las esporas son blanquecinas- grisáceas, elípticas, alargadas, hialinas de 5-8 x 2-3,5 micras",Puede fructificar en cualquier época del año,"['Cabrera', 'Dragonera', 'Formentera', 'Ibiza', 'Mallorca', 'Menorca']","['Alzinar', 'Pinares y otras coníferas', 'Sobre plantas leñosas']",Indiferent,
Psilocybe coprophila (Bull.) P. Kumm,Strophariaceae,Psilocybe,['Deconica coprophila (Bull.: Fr.) Karsten'],,"Seta que en tiempo húmedo presenta en el sombrero una capa gelatinosa, éste mide hasta 3 cm de diámetro, hemisférico al principio volviéndose plano y convexo con un mamellón central obtuso de color más claro que el resto que es de color caramelo. Las láminas están libres, espaciadas con numerosas lamelas de diferentes longitudes y de color gris con la arista más blanca. El pie es fino, cilíndrico y tiene una zona más oscura manchada por la caída de las esporas. Éstas son de violáceas negruzcas a púrpura violáceo en masa, elípticas, de 11-12 x 7-8 micras",Especie tóxica pero no alucinógena como otras Psilocybe ,"['Cabrera', 'Mallorca']",['Excrements'],Tòxic,
Hypholoma fasciculare (Huds.) P. Kumm,Strophariaceae,Hypholoma,,['Bolet de pi'],"Seta con sombrero primeramente globoso para pasar de convexo a plano sin abrirse del todo y de 3 a 7 cm de diámetro. Es de color amarillo más oscuro en el centro y reluciente en tiempo húmedo. Las láminas son finas y apretadas, adnatas o un poco escotadas cerca del pie y de color amarillo que pasan a verde violeta. El pie es cilíndrico, de 3,5 a 10 x 3 a 7 mm de color amarillo azufre y provisto de restos de cortina. Las esporas son de color tierra púrpura en masa, elípticas, con un pequeño poro germinativo, de 6-8 x 4-5 micras",Especie tóxica y puede dar trastornos intestinales e incluso provocar la muerte,"['Mallorca', 'Menorca']","['Alzinar', 'Sobre plantas leñosas']",Tòxic,"['Agárico fasciculado', 'Hifoloma de láminas verdes']"
Hypholoma sublateritium (Schaff.) Quél,Strophariaceae,Hypholoma,,,"Esta seta presenta un sombrero viscoso en tiempo húmedo de 4 a 8 cm de diámetro, primero globoso y carnoso y después tendido, de color rojo en el centro y claro en los márgenes. Las láminas son de color amarillo a amarillo arcilla y con el tiempo se vuelven casi negras por la caída de las esporas. Éstas son elipsoidales, color tierra en masa, de 6-8 x 3-5 micras. El pie es cilíndrico, curvado, fusiforme, vacío, de color amarillo en la parte superior y marrón en el resto y con una cortina fugaz amarillenta en los ejemplares jóvenes","Produce transtornos gastrointestinales, es tóxico",['Mallorca'],['Sobre plantas leñosas'],Tòxic,
Pholiota highlandensis (Peck) A.H. Sm. & Hesler,Strophariaceae,Pholiota,['Pholiota carbonaria (Fr.) Singer'],,"Seta con un sombrero de 6 a 7 cm de diámetro, primero hemisférico y luego plano, que en tiempo húmedo es muy viscoso y seco en tiempo seco. Es de color marrón, un poco cobrizo, más amarilla cerca del margen, enrollado hacia dentro bastante tiempo y con restos de cortina. Las láminas son finas, un poco apretadas y de color blanco cobrizo que vuelven marrones con la caída de las esporas. Éstas son de elipsoidales a ovoides, lisas, de 6-8 x 3-4 micras. El pie, normalmente curvado, de un color amarillento, más blanquecino en la parte superior y más tostado en la inferior. El anillo puede pasar desapercibido y aparecer con una especie de restos de cortina que desaparecen pronto dejando sólo algunos filamentos sobre el pie","Raramente solitario, crece de forma cespitosa o varios individuos con la base del pie soldada. Crece a partir del segundo año del fuego",['Mallorca'],['Llocs cremats'],Indiferent,
Pholiota gummosa (Lasch) Singer,Strophariaceae,Pholiota,,,"Seta con un sombrero de hasta 6 cm de diámetro, que pasa de globoso a más o menos plano. Éste es de color amarillo más o menos oscuro con unas escamas pequeñas un poco más oscuras, que desaparecen con la edad. Es viscoso en tiempo húmedo. El margen del sombrero es excedente y apendiculado. Las láminas son anchas, adnatas, numerosas, de color amarillento a marrón oliva, con muchas lamelas. El pie es cilíndrico, de 3-7 x 0,5-1 cm, de color más pálido que el sombrero, con una zona anular fugaz por debajo la cual presentan unas pequeñas escamas de color marrón. La base frecuentemente se encuentra manchada de color marrón rojizo. Las esporas son de color óxido en masa, elípticas, de 6-7 x 3-4 micras","Se presenta en grupos de diez o más individuos soldados por su pie con la característica de que en tiempo húmedo se encuentra sobre el sombrero una especie de película gruesa, viscosa y elástica",['Mallorca'],"['Pinares y otras coníferas', 'Sobre plantas leñosas']",Indiferent,
Stropharia aeruginosa (Curtis) Quél,Strophariaceae,Stropharia,,,"Seta que se reconoce por el llamativo color azul verdoso del sombrero que con la edad pasa a un verde grisáceo. Éste de hasta 8 cm de diámetro inicialmente es convexo para pasar a plano y presenta una gruesa capa mucilaginosa sobretodo en tiempo húmedo. De joven presenta unas escamas blanquecinas. Las láminas tienen muchas lamelas, gruesas, adnatas, de color blanquecino que con la esporada se tiñen de marrón violeta con la arista blanquecina. El pie es cilíndrico, viscoso y liso por encima del anillo y con escamas algodonosas por la parte inferior. Es también de color azul verdoso. El anillo, situado en la parte superior, es membranoso, viscoso y blanquecino pero teñido por la parte superior por las esporas. Éstas son violáceas en masa, elipsoidales, lisas, de 7-9 x 4-5 micras. El olor de esta seta recuerda al rábano y si la probamos es dulce",Algunos autores la consideran tóxica. Es una seta muy vistosa,['Mallorca'],"['Alzinar', 'Pinares y otras coníferas']",Tòxic,
Stropharia coronilla (Bull.) Fr,Strophariaceae,Stropharia,,,"Seta con un sombrero carnoso hemisférico que se abre rápidamente, de 2 a 5 cm de diámetro, de color paja tostada. Los ejemplares jóvenes presentan el margen con restos flocosos del velo general, debajo del sombrero se encuentran las láminas con numerosas lamelas de coloración varible pasando del blanco al violeta para acabar grises. Las esporas, de color gris a violáceo en masa, son ovales o un poco elípticas, de 7-10 x 5-6 micras. El pie, corto, robusto y de color más claro que el sombrero lleva un anillo estrecho con estrías de color violáceo en la parte superior","No tiene valor culinario, aunque algunos autores la consideran comestible, otro dicen que es tóxica","['Ibiza', 'Mallorca']","['Camps de conreu, vores de camins', 'Pastos, prados y jardines']",Indiferent,
Stropharia semiglobata (Batsch) Quél,Strophariaceae,Stropharia,,,"Presenta un sombrero de hasta 3 cm de diámetro, semihemisférico, de color amarillo paja, reluciente y viscoso en tiempo húmedo. El pie, que es muy largo, de 5 a 10 cm x 2 a 5 mm, es cilíndrico, con base bulbosa, pronto vacío, fibroso y viscoso, es de color más pálido que el sombrero. Generalmente se observan los restos del anillo pegados al pie y manchados de negro por las esporas. Éstas son violáceas en masa, elípticas, lisas, de 15-22 x 8-10 micras",Poco frecuente,"['Cabrera', 'Mallorca', 'Menorca']",['Excrements'],Indiferent,
Suillus mediterraneensis (Jacquet. & J. Blum) Redeuilh,Suillaceae,Suillus,,['Pixacà'],"El sombrero mide casi 10 cm de diámetro, hemisférico al principio, convexo para pasar a plano. Es de color amarillento viscoso volviéndose marrón tostado cobrizo cuando se seca. Tiene tubos igual de largos que el grosor del sombrero y amarillentos o marrones con poros poligonales que dejan salir una especie de látex en forma de gotas de color amarillento-cobrizo. Las esporas son amarillo oliva en masa, fusiformes, de 9-11 x 4,5-5 micras. El pie es cilíndrico, más grueso en el tercio inferior y atenuado en la base donde presenta un micelio blanco con tonos rosados. Presenta granulaciones finas. Es de color blanquecino hacia bajo y más amarillento hacia arriba",Se puede comer rechazando la cutícula del sombrero y los tubos de los ejemplares viejos,"['Cabrera', 'Dragonera', 'Formentera', 'Ibiza', 'Mallorca', 'Menorca']",['Pinares y otras coníferas'],Comestible,
Hydnellum aurantiacum (Batsch.) P. Karst,Thelephoraceae,Hydnellum,"['Hydnum floriforme Schaeff.: Secr.', 'Hydnum aurantiacum Albert.- Schw.', 'Calodon aurantiacum (Batsh: Fr.) Karsten']",,"Esta seta tiene un sombrero de 3 a 6 cm de diámetro, con la superficie rugosa y con proliferaciones en forma de pequeñas puntas, al principio plano y después en forma de embudo. Es de color crema anaranjado formando zonas concéntricas excepto el margen que es blanco. Debajo del sombrero tiene el himenio en forma de agujas decurrentes, de 2-3 mm, que cambian de color blanco a naranja para ser finalmente de color marrón ocre. El pie es cilíndrico, un poco hinchado y también de color naranja. Las esporas son marrones en masa, subglobosas, cubiertas de berrugas muy marcadas, de 4-6 x 4-5 micras","Coloniza sitios grandes, a pesar de no ser demasiado frecuente, es abundante en sus localizaciones",['Mallorca'],['Pinares y otras coníferas'],Indiferent,
Hydnellum concrescens (Pers.) Banker,Thelephoraceae,Hydnellum,['Calodon zonatum (Fr.) Karst'],,"Seta que crece con numerosos individuos alrededor incluso pegado por los sombreros. Estos miden hasta 7 cm de diámetro y tienen forma de embudo, con escamas levantadas en el centro, hecho que hace que adquiera forma de flor. Es seco y aterciopelado, de color marrón cobrizo oscuro con los márgenes zonados y blanquecinos. Por debajo está compuesto de agujitas finas, pequeñas y muy numerosas y apretadas, primero blanquecinas y posteriormente del mismo color que el sombrero. El pie también del mismo color es muy corto y las esporas son marrón en masa, de 5-6 x 4-5 micras",Huele a pepino y tiene gusto amargo,"['Mallorca', 'Menorca']",['Alzinar'],Indiferent,
